ttl,bg,max_hp,init_skill,init_luck,init_food,theme
221,normal,"Finishing the juice he gave me, strength returns to my parched body. Each time the cold liquid passes through my throat, Kevin's words feel like they permeate my heart once more. I put the empty juice can in my backpack and pedaled back toward home. \n\nもらったジュースを飲み干すと、乾いた身体に力が戻る。\n冷たい液体が喉を通るたび、足立さんの言葉が改めて胸に染み渡る気がした。\n僕はジュースの空き缶をバックパックに入れ、再び家路へとペダルを漕ぎ出した。","Hurry home(家路を急ぐ)→23",,,,,bgm_peace.mp3,img/bgi_sky.png,!eat
2211,normal,"With each rotation of the bike pedals, the scenery of Kevin's house recedes. I feel tempted to turn back, but that would only waste energy for ending the adventure. I faced forward and started running. \n\n自転車のペダルを一漕ぎするたびに、足立の家の風景が遠ざかる。\n後ろ髪を引かれる思いで引き返そうとするが、それは冒険を終わらせるためのエネルギーを浪費するだけだ。\n僕は前を向き、走り出した。","Proceed again(再び進む)→21",,,,,bgm_peace.mp3,img/bgi_sky.png,hp-1
23,battle,"On the way back, the final and greatest trial awaited me. The sky was dark, and the wind grew colder. The 'despair toward the future' lurking in my heart appeared again as a giant black shadow. Inner voices like 'Adult Kevin was that tired, too' and 'Your eyes will get clouded like that, too' blocked my way. However, I won't stop anymore. I have what Kevin taught me through the letter, and the promise I made with him. I gripped the handlebars powerfully and stood up against this final shadow to carve out my own future. This is the trial for me to graduate from being a 'child' and take a step toward being an 'adult.' \n\n帰り道、最後にして最大の試練が僕を待ち受けていた。\n空は暗く、風は冷たさを増していく。\n僕の心の中に潜んでいた「未来への絶望」が、巨大な黒い影となって再び姿を現したのだ。\n「大人の足立もあんなに疲れていたじゃないか」「お前もあんな風に目が濁るんだ」という内なる声が、僕の行く手を阻む。\nしかし、僕はもう立ち止まらない。\n足立さんが手紙を通じて僕に教えてくれたこと、そして僕が彼と交わした約束が、今の僕にはある。\n僕はハンドルを力強く握りしめ、自分の未来を自分で切り拓くために、この最後の影へと立ち向かった。\nこれは僕が「子供」を卒業し、「大人」への一歩を踏み出すための試練なのだ。","Break through the shadow(影を打ち破る)",Despair for the Future 未来への絶望,8,7,24,bgm_battle.mp3,img/bgi_battle2.png,
24,normal,"After a fierce battle within my heart, I finally shook off my own shadow. I realized the pedals that were so heavy are now turning surprisingly light. It became time for the sun to set, but there was no sunset, and the sky remained cloudy as ever. ...However, in a corner of that sky, I felt like a faint light was leaking through. No, it must be shining. Surely. \n\n激しい心の中の戦いの末、僕はついに自分自身の影を振り払った。\n気がつくと、あんなに重かったペダルが驚くほど軽快に回っている。\n日が沈む時刻になったが、夕焼けはなく、相変わらず空は曇ったままだった。\n\n･・・しかし、そんな空の片隅で、かすかに日の光が漏れているような気がした。\n\nいや、必ず光っているだろう。\n\n必ず。","The End(おわり)→25",,,,,bgm_happy.mp3,img/bgi_last.png,
25,end,"『TIME CAPSULE』\n\nI have no time to hang out with brats like you. \nI have no time to play with you. \n\nI have no leisure to gaze at the sunset. \nI have no reason to help you. \n\nIt's creepy to laugh with you. \nI'm fed up with dealing with kids.\n\nA filthy letter from somewhere, making a sunken heart jump and dance.\nRemember the days, the days of being a boy.\n\nA letter of hope from the past, written by my old self to myself.\n\nAre you well? \nAre you doing well? \n\nDo you remember me?\n\n\nガキなんぞに付き合ってる暇はない\nお前らと遊んでる暇はない\n\n夕陽を眺める余裕などない\nお前を助ける理由もない\n\nお前と笑うのは気味が悪い\nガキの相手をするのはうんざりだ\n\n\nどこからか来た 薄汚い手紙 沈んだ心 湧き躍らせて\n\n思い出せ日々 少年の日々\n\n過去から来た 希望の手紙 昔の僕が 自分に書いた\n\nお前 元気か 元気でいるか 俺の事 覚えているか\n\n\n©1993,2026 Factory Digital Entertainment","The End(おわり)",,,,,bgm_timecapsule.mp3,img/bgi_fin.png,
