id,type,text,options,e_name,e_skill,e_hp,next,bgm,bgi,effect,,
1,normal,"【あらすじ/Summary】\n\n光源氏の養女となった玉鬘に対し、多くの公達が求愛の文を寄せます。源氏は彼女の反応を楽しみつつ、自らも彼女に惹かれる心を抑えきれません。五月雨の降る夜、源氏は玉鬘のもとを訪れ、隠し持っていた蛍を放ちます。その微かな光に照らし出された玉鬘の美しさは、兵部卿宮を深く魅了しました。\n\n【登場人物/Characters】\n\n光源氏：36歳。玉鬘：22歳。兵部卿宮：源氏の弟。\n\n【見どころ/Highlights】\n\n蛍の光を用いた演出と、源氏による物語評論。 \n\nEnglish:\nThis chapter depicts the suitors flocking to Tamakazura. Genji, acting as her guardian, enjoys the chaos while harboring his own feelings. On a rainy night, he releases fireflies to illuminate her beauty for Prince Hyobukyo. This chapter is famous for the 'Firefly' scene and Genji's discourse on the nature of fiction.",次へ進む (Next)→2,,,,,court_music.mp3,genji_intro.jpg,,,
2,normal,"【原文/Original】\n\n五月雨のつれづれなるに、御前近く蛍を多く包ませて持てわたらせ給へり。玉鬘の君の御前、灯影いとほのかなり。「こは、いづちよりも」とて、御几帳の綻びより、蛍をふと放ち給へれば、かき消えたりつる光、あらはに、御几帳の内を照らし出でたり。\n\n【現代語訳/Modern Japanese】\n\n五月雨が降り続く退屈な折、源氏は蛍をたくさん包ませて玉鬘のもとへ向かいました。彼女の部屋は灯火がかすかに灯る程度です。「これはどこから来たのでしょう」と言いながら、源氏は几帳の隙間から蛍を放ちました。消えかかっていた光が一斉に放たれ、几帳の内側に座る玉鬘の姿を鮮やかに照らし出しました。\n\n【English】\n\nDuring the tedious rains of the fifth month, Genji visited Tamakazura with many fireflies wrapped in a cloth. Her room was dimly lit. 'Where could these have come from?' he asked, and suddenly released the fireflies through a gap in her screen. The lights, which had seemed extinguished, flared up and illuminated the inner sanctuary where she sat.","庭を眺める (Look at the garden)→3,前の場面へ (Previous)→1",,,,,rain_ambient.mp3,veranda.jpg,,,
3,normal,"【原文/Original】\n\n兵部卿宮、例の忍びてものし給へるに、かの蛍の光、ふと見えければ、いとあやしく、何ならむと思ほしつつ見給ふ。玉鬘の君は、いとはしたなき心地して、扇をさし隠し給へるさま、いとをかし。\n\n【現代語訳/Modern Japanese】\n\n忍んで訪れていた兵部卿宮は、突然現れた蛍の光に驚き、不審に思いながらも注視しました。玉鬘は、突然の光に照らされて極めてきまりの悪い思いをし、扇で顔を隠しました。その仕草や佇まいは、言葉に尽くせぬほど風情があり、見る者の心を揺さぶるものでした。\n\n【English】\n\nPrince Hyobukyo, who was visiting in secret as usual, was startled by the sudden glow of the fireflies. He wondered what it could be and watched intently. Tamakazura felt terribly embarrassed by the exposure and quickly hid her face behind a fan. The sight of her in that moment was indescribably charming and elegant.","和歌を詠む (Compose a poem)→4,前の場面へ (Previous)→2",,,,,night_ambient.mp3,fireflies.jpg,,,
4,normal,"【原文/Original】\n\n「声はせで 身をのみ焦がす 蛍こそ 言ふより勝る 思ひなるらめ」と、宮は聞こえ給ふ。源氏の君は、すこし遠ざかりて、このありさまを見守り給ふ。心の内には、えならぬ愛敬の添へるを、思ひ比べ給ふに、紫の上の御美しさに並ぶべきものなしと思ほす。\n\n【現代語訳/Modern Japanese】\n\n「声は出さずとも、この身を焦がして光る蛍こそ、言葉で愛を語る者よりも深い思いを抱いているのでしょう」と宮は詠みかけます。源氏は少し離れた場所から、この様子を観察していました。玉鬘の美しさを認めつつも、心の中ではやはり最愛の紫の上の美しさこそが至高であると比較せずにはいられませんでした。\n\n【English】\n\n'The firefly burns its body in silence, a love perhaps deeper than that expressed in words,' the Prince offered in verse. Genji watched the scene from a distance. Though he admired Tamakazura's grace, in his heart he compared her to Murasaki, concluding that nothing could match Murasaki's peerless beauty.","休息をとる (Take a rest)→5,前の場面へ (Previous)→3",,,,,koto_music.mp3,screen.jpg,,,
5,normal,"【休息/Rest】\n\n六条院の夏の庭は、涼やかな風が通り抜けます。玉鬘は慌ただしい求愛の応酬に疲れ、しばしの休息をとることにしました。女房たちが用意した涼しげな菓子と冷たい飲み物が、彼女の心を落ち着かせます。\n\n【English】\n\nThe summer gardens of Rokujo-in allow a cool breeze to pass through. Exhausted by the incessant courtship, Tamakazura decided to take a short rest. The refreshing sweets and cold drinks prepared by her ladies-in-waiting calmed her spirit.","次へ進む (Next)→6,前の場面へ (Previous)→4",,,,,garden_breeze.mp3,summer_room.jpg,!eat,,
6,battle,"【心の葛藤/Internal Conflict】\n\n玉鬘の心の中では、実の父である内大臣への思慕と、養父でありながら恋情を向けてくる源氏への戸惑いが渦巻いています。彼女は自分を律しようとしますが、周囲の期待と現実の板挟みに遭い、精神的な戦いを強いられます。\n\n【English】\n\nWithin Tamakazura's heart, a conflict rages between her longing for her real father, the Minister of the Interior, and her confusion toward Genji, who acts as her guardian yet displays romantic affection. She struggles to maintain her composure amidst social expectations.",自分を律する (Discipline oneself),心の迷い (Inner Hesitation),8,10,7,battle_theme.mp3,inner_mind.jpg,,,
7,normal,"【物語論/On the Tale】\n\n源氏は、物語に耽溺する玉鬘を見て、物語というものの意義について語り始めます。「世の中に語り継がれる物語には、真実が含まれている。単なる嘘ではなく、人間の本質を写し取るものなのだ」という源氏の言葉は、日本最古の文芸批評として名高い場面です。\n\n【English】\n\nSeeing Tamakazura engrossed in illustrated romances, Genji begins to discuss the significance of fiction. He argues that tales are not merely lies, but contain truths that reflect human nature. This discourse is famous as the earliest form of literary criticism in Japan.","さらに詳しく聞く (Listen more)→8,前の場面へ (Previous)→6",,,,,philosophical.mp3,library.jpg,,,
8,normal,"【原文/Original】\n\n「物語とて、人の心を動かすもの、いと多かり。これ、ただ虚言とのみ思ふべきにあらず。仏の教へも、方便とて、真実の道へ導くものなり。物語もまた、世のありさまを書きとどめて、後の世に伝ふるものなれば」と、源氏は深く語り給ふ。\n\n【現代語訳/Modern Japanese】\n\n「物語といって、人の心を動かすものは実に多い。これらを単なる作り話だと思うべきではない。仏の教えも、方便といって真実へ導くための手段である。物語もまた、世の中のありのままを書き留め、後世に伝える役割があるのだ」と源氏は深く語りました。\n\n【English】\n\n'Many tales move the human heart deeply,' Genji spoke profoundly. 'One should not dismiss them as mere fabrications. Just as the Buddha's teachings use parables to lead one to truth, romances record the state of the world to pass it on to future generations.'","庭を歩く (Walk in the garden)→9,前の場面へ (Previous)→7",,,,,meditative.mp3,veranda_day.jpg,,,
9,normal,"【六条院の夏/Summer at Rokujo-in】\n\n六条院の夏の町では、蓮の花が池に咲き誇り、水鳥が羽を休めています。源氏は、かつての夕顔との悲劇的な恋を玉鬘に重ねつつ、彼女を政治的な駒としてではなく、一人の女性として大切にしたいと願うのでした。しかし、その想いは複雑に絡み合っています。\n\n【English】\n\nIn the Summer Quarter of Rokujo-in, lotus flowers bloom in the pond and waterfowls rest their wings. Genji overlaps his tragic past love for Yugao with Tamakazura, wishing to cherish her as a woman rather than a political pawn. However, his feelings remain intricately tangled.","奥へ進む (Go deeper)→10,前の場面へ (Previous)→8",,,,,nature_ambient.mp3,lotus_pond.jpg,,,
10,battle,"【源氏の誘惑/Genji's Temptation】\n\n源氏は冗談めかしながらも、玉鬘に近づき、その手を握ります。養父としての節度を守るべき理性を、彼女への情熱が脅かします。この瞬間、源氏自身の心の中で道徳と欲望が激しくぶつかり合います。\n\n【English】\n\nGenji approaches Tamakazura with a jest, but takes her hand. His passion threatens the reason that dictates he should maintain decorum as her guardian. At this moment, morality and desire clash violently within Genji's own heart.",理性を保つ (Maintain reason),抑えきれぬ情熱 (Unstoppable Passion),9,12,11,tension.mp3,dark_room.jpg,,,
11,normal,"【玉鬘の当惑/Tamakazura's Perplexity】\n\n源氏の露骨なアプローチに対し、玉鬘は困惑しきっています。彼女は亡き母・夕顔の面影を追う源氏の孤独を感じつつも、自分がその代わりを務めることに強い抵抗を感じていました。彼女の沈黙は、無言の抵抗でもありました。\n\n【English】\n\nTamakazura is utterly perplexed by Genji's overt advances. While she senses Genji's loneliness in chasing the shadow of her late mother, Yugao, she feels a strong resistance to serving as a substitute. Her silence is a wordless protest.","静かに去る (Leave quietly)→12,前の場面へ (Previous)→10",,,,,melancholy.mp3,moonlight.jpg,,,
12,normal,"【夕暮れの情景/Evening Scene】\n\n日が沈み、六条院に帳が下ります。遠くで鳴く蜩の声が、はかない人の世を象徴しているかのようです。源氏は自らの振る舞いを反省しつつも、玉鬘をめぐる公達たちの競争を煽ることで、彼女の価値をさらに高めようと画策します。\n\n【English】\n\nAs the sun sets, darkness falls over Rokujo-in. The distant cry of the cicadas seems to symbolize the fleeting nature of the human world. Reflecting on his behavior, Genji nevertheless plots to increase Tamakazura's value by inciting competition among her suitors.","次へ (Next)→13,前の場面へ (Previous)→11",,,,,cicadas.mp3,sunset_garden.jpg,,,
13,normal,"【近江の君/The Lady from Omi】\n\n一方、内大臣のもとには、地方で育った風変わりな娘「近江の君」が引き取られていました。彼女の粗野で活発すぎる振る舞いは、洗練された都の貴族たちの中で浮いてしまい、物語に滑稽な彩りを添えています。\n\n【English】\n\nMeanwhile, the Minister of the Interior has taken in a strange daughter from the provinces, the Lady from Omi. Her coarse and overly energetic behavior stands out among the refined capital nobles, adding a touch of comedy to the narrative.","笑い飛ばす (Laugh it off)→14,前の場面へ (Previous)→12",,,,,cheerful.mp3,noisy_room.jpg,,,
14,normal,"【対比の妙/Masterful Contrast】\n\n高貴で奥ゆかしい玉鬘と、騒々しく教養に欠ける近江の君。作者・紫式部は、この二人の対照的な女性を描くことで、貴族社会における美徳と「育ち」の影響を鋭く描き出しています。内大臣は、玉鬘のような娘を欲して止みません。\n\n【English】\n\nThe noble and modest Tamakazura versus the noisy and uneducated Lady from Omi. By portraying these two contrasting women, Murasaki Shikibu sharply illustrates the virtues of aristocratic society and the influence of upbringing. The Minister longs for a daughter like Tamakazura.","深く考える (Think deeply)→15,前の場面へ (Previous)→13",,,,,thoughtful.mp3,tatami_room.jpg,,,
15,normal,"【休息/Rest】\n\n物語の中休みです。六条院の女房たちは、季節の移ろいを感じながら、美しい絹の衣を整えています。香を焚きしめ、身なりを整えることも、この時代の重要な教養であり、戦いの一部でもありました。\n\n【English】\n\nA brief interlude in the story. The ladies of Rokujo-in prepare beautiful silk robes, sensing the changing of the seasons. Burning incense and grooming oneself were essential accomplishments and even a form of battle in this era.","次へ進む (Next)→16,前の場面へ (Previous)→14",,,,,incense_smell.mp3,dressing_room.jpg,!eat,,
16,battle,"【噂との戦い/Battle with Rumors】\n\n宮中では、玉鬘の出自や源氏との関係について、心ない噂が飛び交っています。彼女はそれらの言葉の刃から自分の心を守らなければなりません。気高く振る舞うことが、彼女にとっての最大の武器となります。\n\n【English】\n\nIn the palace, unkind rumors circulate about Tamakazura's origins and her relationship with Genji. She must protect her heart from these verbal blades. Acting with dignity becomes her greatest weapon.",気高く振る舞う (Act with dignity),世間の噂 (Social Rumors),8,12,17,ominous.mp3,palace_hall.jpg,,,
17,normal,"【秋の訪れ/Arrival of Autumn】\n\n夏が過ぎ、風に秋の気配が混じり始めます。蛍の光は消え、代わりに虫の声が庭を満たします。源氏は、玉鬘への想いを整理しきれないまま、次の季節へと歩みを進めます。彼の人生は、常に美と苦悩が隣り合わせでした。\n\n【English】\n\nSummer passes, and the hint of autumn enters the breeze. The light of the fireflies fades, replaced by the chirping of insects. Genji moves toward the next season without fully resolving his feelings for Tamakazura. His life is an ever-present blend of beauty and anguish.","月を見る (Look at the moon)→18,前の場面へ (Previous)→16",,,,,autumn_wind.mp3,moon_view.jpg,,,
18,normal,"【原文/Original】\n\n「秋近うなりぬるにや、風の音も心細く、もののあはれなるを、玉鬘の君は、いとど心細く思ほし出づることのみ多かり。内大臣の御ありさま、いかならむと、恋しくのみ思ひ聞こえ給ふ」\n\n【現代語訳/Modern Japanese】\n\n「秋が近づいたせいでしょうか、風の音も心細く、物寂しく感じられます。玉鬘はますます心細く、物思いに耽ることが多くなりました。実の父である内大臣は今どうされているだろうかと、恋しく思うばかりなのでした」\n\n【English】\n\n'Perhaps because autumn is near, the sound of the wind is lonely and moving. Tamakazura found herself lost in melancholy thoughts more often. She could only think longingly of her father, the Minister of the Interior, wondering how he might be.'","心を鎮める (Calm the mind)→19,前の場面へ (Previous)→17",,,,,sad_koto.mp3,autumn_leaves.jpg,,,
19,normal,"【結び/Conclusion】\n\n「蛍」の巻は、美しくも残酷な光の演出によって、登場人物たちの隠された情念を照らし出しました。物語は、単なる恋物語を超え、人間の真実を追求する文学へと昇華されています。玉鬘の数奇な運命は、まだ始まったばかりです。\n\n【English】\n\nThe 'Firefly' chapter illuminated the hidden passions of the characters through a beautiful yet cruel display of light. The tale transcends a simple romance, evolving into literature that pursues human truth. Tamakazura's strange fate has only just begun.","最終場面へ (To the final scene)→20,前の場面へ (Previous)→18",,,,,grand_finale.mp3,shrine.jpg,,,
20,end,"【次巻予告/Next Chapter Preview】\n\n次巻「常夏（とこなつ）」。\n夏の盛りに、源氏と内大臣の対立が深まります。近江の君の騒動は加速し、玉鬘をめぐる恋の鞘当ても激化していきます。美しき「常夏の花（撫子）」に例えられるのは誰か。乞うご期待。\n\n【English】\n\nNext Chapter: 'Tokonatsu' (The Pink Flower).\nIn the height of summer, the rivalry between Genji and the Minister deepens. The chaos surrounding the Lady from Omi accelerates, and the battle for Tamakazura's heart intensifies. Who will be compared to the beautiful 'Wild Carnation'? Stay tuned.",おわり (End),,,,,clear_sky.mp3,next_chapter.jpg, ,,
