id,type,text,options,e_name,e_skill,e_hp,next,bgm,bgi,effect,,
1,normal,"【あらすじ/Summary】\n薫は、亡き大君に瓜二つの浮舟を宇治の隠れ家に迎えようと画策します。しかし、匂宮もまた浮舟の存在を知り、彼女を追い求めます。板挟みになる浮舟と、執着する貴公子たちの愛憎劇が幕を開けます。\n\n【登場人物と年齢/Characters】\n薫（Kaoru）: 26歳。浮舟（Ukifune）: 20歳前後。匂宮（Niou no Miya）: 27歳。\n\n【見どころ/Highlights】\n東屋のしめやかな情景と、繊細な心理描写。\n\nKaoru plans to take Ukifune, the image of his lost love Oimi, to a secret villa in Uji. However, Prince Niou also discovers her existence. A drama of obsession and conflict begins between the two nobles and the fragile Ukifune.",物語を始める (Start Story)→2,,,,,court_music.mp3,heian_room.jpg,,,
2,normal,"【原文/Original】\n秋もはてがたの、空のけしき、もの心細きに、薫の兵部卿の宮、あやしう、心にかけて、宇治のわたりをのみ、思しやられたまふ。\n\n【現代語訳/Modern Translation】\n秋も終わろうとする頃、空の様子も心細く、薫の君は、妙に心が惹かれて、宇治のあたりばかりを思いやっておいでになります。亡き大君への執着が、生き写しの浮舟へと向かっているのです。\n\n【English】\nAs autumn drew to a close, the sky took on a lonely hue. Kaoru found his heart strangely drawn, his thoughts wandering constantly toward Uji. His lingering obsession with the late Oimi had now shifted toward her likeness, Ukifune.","次へ (Next)→3,戻る (Back)→1",,,,,autumn_wind.mp3,autumn_garden.jpg,,,
3,normal,"【原文/Original】\n三条の宮には、中君、いとどしう、ものむつかしき御心地にて、臥したまへるを、宮は、いとほしう、あはれに思しつつ、のどやかに物語したまふ。\n\n【現代語訳/Modern Translation】\n三条の宮では、中君がひどくつわりで気分が悪く、横になっておいでですが、匂宮はそれをいたわしく思い、のどかにお話し相手をなさっています。しかし、その心の中には新たな好奇心が芽生えていました。\n\n【English】\nAt the Sanjo Palace, Naka no Kimi lay resting, suffering from severe morning sickness. Prince Niou stayed by her side, speaking gently and showing concern. Yet, within his heart, a new curiosity about her half-sister was beginning to bloom.","次へ (Next)→4,戻る (Back)→2",,,,,koto_music.mp3,royal_chamber.jpg,,,
4,normal,"【原文/Original】\n中君の御もとに、浮舟の君、忍びてものしたまふ。そのありさま、いとあてに、なまめかしう見えたまふを、宮は、のぞき見たまひて、いとど心動かしたまふ。\n\n【現代語訳/Modern Translation】\n中君のもとに、浮舟が人目を忍んで訪れていました。その姿は非常に気品があり、若々しく優雅に見えたので、匂宮は物陰から覗き見し、激しく心を動かされたのです。\n\n【English】\nUkifune visited Naka no Kimi in secret. Her appearance was so noble and youthfully elegant that Prince Niou, catching a glimpse of her from behind a screen, felt his heart stir violently with desire.","次へ (Next)→5,戻る (Back)→3",,,,,suspense.mp3,sliding_door.jpg,,,
5,normal,"【原文/Original】\n宮の御心、いとあやしう、またなきもの狂ひをのみしたまふに、この人のありさまを聞き出でたまひて、いかでかと思しわたる。\n\n【現代語訳/Modern Translation】\n匂宮の御心は、常軌を逸した恋の情熱に燃えやすく、浮舟の境遇を聞き出すと、何とかして手に入れようと思案し続けました。一度火がつくと止まらないのがこの宮の性分です。\n\n【English】\nPrince Niou’s heart was prone to erratic and mad passions. Having learned of Ukifune's circumstances, he pondered endlessly on how to make her his own. Once his interest was piqued, there was no stopping him.","次へ (Next)→6,戻る (Back)→4",,,,,romance_theme.mp3,palace_hall.jpg,,,
6,battle,【心理戦：匂宮の誘惑/Psychological Battle: Niou's Temptation】\n匂宮は中君の女房を抱き込み、浮舟の寝所に忍び込もうとします。浮舟の心には、恐怖と困惑が渦巻きます。この強引な求愛に、彼女の精神は耐えられるでしょうか。\n\nPrince Niou bribes Naka no Kimi's maid to sneak into Ukifune's room. Fear and confusion swirl in Ukifune's heart. Can her spirit withstand this aggressive courtship?,心を強く持つ (Stay Strong),匂宮の情熱 (Niou's Passion),7,6,7,battle_bgm.mp3,bedroom.jpg,,,
7,normal,"【原文/Original】\n浮舟の君は、あさましう、いみじきことに思ひ惑ひたまへど、宮の御強引さには、え防ぎたまはで、つひに許したまふ。\n\n【現代語訳/Modern Translation】\n浮舟は、呆然として悲しいことに思い惑いなさいましたが、匂宮の強引な振る舞いには防ぎようもなく、ついに契りを結んでしまいました。彼女の不運な流転がここから始まります。\n\n【English】\nUkifune was lost in shock and grief, but she could not resist the Prince's forceful advances, and eventually yielded. Thus began the tragic drift of her fate.","次へ (Next)→8,戻る (Back)→6",,,,,sad_strings.mp3,morning_mist.jpg,,,
8,normal,"【原文/Original】\n薫の君は、このことを知らず、宇治の造土に、浮舟を移さむと、いそぎ用意したまふ。道すがらの情景も、いとあはれなり。\n\n【現代語訳/Modern Translation】\n薫は、この一件を知る由もなく、宇治の山荘に浮舟を移そうと急いで準備を進めます。道中の景色も、どことなく物悲しく感じられるのでした。\n\n【English】\nKaoru, unaware of what had transpired, hurriedly prepared to move Ukifune to the Uji villa. Even the scenery along the road seemed to carry a hint of melancholy.","次へ (Next)→9,戻る (Back)→7",,,,,travel_theme.mp3,uji_road.jpg,,,
9,normal,"【原文/Original】\n宇治の家は、荒れはてて、草深く、水の音のみぞ、昔を思ひ出でさせて、いとど悲しき。\n\n【現代語訳/Modern Translation】\n宇治の山荘は荒れ果てて、草が深く生い茂り、ただ川の音だけが昔のことを思い出させ、ますます悲しみが募ります。大君がいた頃の面影はどこにもありません。\n\n【English】\nThe Uji villa was dilapidated and overgrown with weeds. Only the sound of the river evoked memories of the past, deepening the pervasive sadness. No trace remained of the days when Oimi was alive.","次へ (Next)→10,戻る (Back)→8",,,,,river_sound.mp3,uji_villa.jpg,,,
10,normal,"【休息/Rest】\n長旅の疲れを癒しましょう。宇治の山里で、質素ながらも心のこもった食事が振る舞われます。\n\nRest and recover from your long journey. In the mountain village of Uji, a simple but heartfelt meal is served.",食事をとる (Eat)→11,,,,,,,!eat,,
11,normal,"【原文/Original】\n薫の君、東屋の柱に寄りかかりて、月を眺めたまふ。浮舟の顔を見れば、いよいよ大君に似て、涙をとどめがたし。\n\n【現代語訳/Modern Translation】\n薫は東屋の柱に寄りかかり、月を眺めておいでです。浮舟の顔を見ると、ますます大君に似ていて、涙をこらえることができません。彼は影を追っているに過ぎないのでしょうか。\n\n【English】\nKaoru leaned against a pillar of the east cottage (Azumaya), gazing at the moon. Looking at Ukifune's face, he found her resemblance to Oimi so striking that he could not hold back his tears. Was he merely chasing a shadow?","次へ (Next)→12,戻る (Back)→10",,,,,moon_bgm.mp3,veranda.jpg,,,
12,normal,"【原文/Original】\n浮舟は、薫の優しさに触れつつも、匂宮とのあやまちを思い出し、胸のつぶれる心地がいたします。誰にも言えぬ秘密が、彼女を苦しめます。\n\n【現代語訳/Modern Translation】\n浮舟は、薫の誠実な優しさに触れる一方で、匂宮との過ちを思い出し、胸が締め付けられる思いです。誰にも打ち明けられない秘密が、彼女の心を蝕んでいきます。\n\n【English】\nWhile touched by Kaoru's sincere kindness, Ukifune was tormented by the memory of her encounter with Prince Niou. The secret she could tell no one began to eat away at her heart.","次へ (Next)→13,戻る (Back)→11",,,,,tension.mp3,inner_room.jpg,,,
13,normal,"【原文/Original】\n宇治の川霧、立ちわたりて、もの隔てたるやうに見ゆるも、わが身の行く末のやうなり、と浮舟は思ふ。\n\n【現代語訳/Modern Translation】\n宇治の川霧が立ち込め、すべてを隔てているように見えるのも、まるで自分の行く末のようだと浮舟は思います。先が見えない不安が、彼女を包み込みます。\n\n【English】\nThe river mist of Uji rose and spread, veiling everything from sight. Ukifune felt as though this was a reflection of her own uncertain future, wrapped in a fog of anxiety.","次へ (Next)→14,戻る (Back)→12",,,,,mist_bgm.mp3,river_mist.jpg,,,
14,normal,"【原文/Original】\n薫、こまごまと浮舟に語りかけたがふ。その詞の端々に、亡き人への思ひぞ溢れける。浮舟は、身代わりとしての辛さを噛みしめる。\n\n【現代語訳/Modern Translation】\n薫は、細やかに浮舟に語りかけます。しかし、その言葉の端々には、亡き大君への思いが溢れていました。浮舟は、自分がただの身代わりであるという辛さを噛みしめるのでした。\n\n【English】\nKaoru spoke to Ukifune with great care. Yet, in every word, his yearning for the deceased Oimi was evident. Ukifune keenly felt the pain of being nothing more than a substitute.","次へ (Next)→15,戻る (Back)→13",,,,,melancholy.mp3,dim_light.jpg,,,
15,battle,"【心理戦：自己嫌悪との闘い/Psychological Battle: Struggle with Self-Loathing】\n薫の誠実さと匂宮の情熱。二人の貴公子の間で、浮舟の心は引き裂かれ、自己嫌悪に陥ります。彼女は自分の存在価値を見失いそうになります。\n\nBetween Kaoru's sincerity and Niou's passion, Ukifune's heart is torn apart. She falls into deep self-loathing and begins to lose her sense of self-worth.",自分を保つ (Maintain Self),迷いの中の心 (Confused Heart),8,8,16,battle_bgm.mp3,dark_room.jpg,,,
16,normal,"【原文/Original】\n日は高く差し昇りて、霧もようやく晴れゆく。されど、人の心のうちは、いとど暗うなりゆく。薫は都へ帰る準備をす。\n\n【現代語訳/Modern Translation】\n日は高く昇り、霧もようやく晴れていきます。しかし、人々の心の内は、ますます暗くなっていくようです。薫は浮舟を残して都へ帰る準備を整えます。\n\n【English】\nThe sun rose high and the mist finally began to clear. Yet, within the hearts of the people, the darkness only seemed to deepen. Kaoru prepared to return to the capital, leaving Ukifune behind.","次へ (Next)→17,戻る (Back)→15",,,,,sunny_yet_sad.mp3,morning_garden.jpg,,,
17,normal,"【原文/Original】\n東屋の、柱の陰に、身を隠して、見送りたてまつる浮舟の、うしろめたき心地、いへばさらなり。\n\n【現代語訳/Modern Translation】\n東屋の柱の陰に身を隠して、薫を見送る浮舟の、後ろめたく不安な心地は、言葉では言い尽くせません。彼女の孤独な生活が、この宇治で始まろうとしています。\n\n【English】\nHiding behind a pillar of the cottage, Ukifune watched Kaoru depart. Her feelings of guilt and apprehension were beyond words. Her solitary life in Uji was about to begin.","次へ (Next)→18,戻る (Back)→16",,,,,lonely_flute.mp3,pillar_shadow.jpg,,,
18,normal,"【休息/Rest】\n物語も終盤です。宇治の冷たい空気の中で、温かいお粥を食べて一息つきましょう。\n\nThe story nears its end. In the cold air of Uji, take a breath and enjoy some warm rice porridge.",食事をとる (Eat)→19,,,,,,,!eat,,
19,normal,"【原文/Original】\nこの巻の、もののあはれ、人の心の通はぬもどかしさ、宇治の川波とともに、深く心に刻まるるなり。\n\n【現代語訳/Modern Translation】\nこの「東屋」の巻の、情趣の深さや、人の心が通い合わないもどかしさは、宇治川の波の音とともに、深く心に刻まれるものです。\n\n【English】\nThe profound pathos and the frustration of hearts failing to meet in this chapter, 'Azumaya', are etched deeply into the mind, much like the sound of the Uji River waves.","次へ (Next)→20,戻る (Back)→18",,,,,closing_theme.mp3,river_sunset.jpg,,,
20,end,"【次巻予告：第51帖「浮舟」/Next Chapter Preview: Ukifune (A Drifting Boat)】\nついに物語の焦点は、浮舟自身の葛藤へと移ります。匂宮が宇治を訪れ、薫との対立が決定的になります。究極の選択を迫られた浮舟が選ぶ道とは？\n\n【見どころ/Highlights】\n匂宮の情熱的な宇治訪問。浮舟の失踪へのカウントダウン。\n\nThe focus shifts to Ukifune's own internal conflict. Niou visits Uji, and his rivalry with Kaoru becomes definitive. Pressed to make an ultimate choice, what path will Ukifune take?\n\nHighlight: Niou's passionate visit to Uji. The countdown to Ukifune's disappearance.",おわり (The End),,,,,clear_fanfare.mp3,next_chapter.jpg, ,,
